{
  "$schema": "http://json-schema.org/draft-04/schema#",
  "type": "object",
  "properties": {
    "topology": {
      "type": "array",
      "description": "A list of name/type map objects that define the system topology."
    },
    "fluid": {
      "type": "object",
      "description": "A fluid definition object."
    },
    "building": {
      "type": "object",
      "description": "A map of available building definition objects."
    },
    "ground-heat-exchanger": {
      "type": "object",
      "description": "A collection of objects that define a ground heat exchanger system."
    },
    "pump": {
      "type": "object",
      "description": ""
    },
    "towers": {
      "type": "object",
      "description": ""
    },
    "generic-loads": {
      "type": "object",
      "description": ""
    },
    "simulation-control": {
      "type": "object",
      "description": ""
    },
    "version": {
      "type": "number",
      "description": "An integer version ID for this input structure, for future-proofing."
    }
  },
  "required": [
    "topology",
    "fluid",
    "ground-heat-exchanger",
    "simulation-control",
    "version"
  ]
}
